"gene"	"adj.pval.Origin"	"adj.pval.Treatment"	"adj.pval.LifeStage"	"adj.pval.Origin_x_Treatment"	"adj.pval.Origin_x_LifeStage"	"adj.pval.Treatment_x_LifeStage"	"adj.pval.Origin_x_Treatment_x_LifeStage"	"Length"	"GO_Name"	"GO_IDs"
"Pastreoides30735"	0.010196082085648	0.00474508971625887	0.475466877107867	3.52544773110046e-05	0.564226061925276	0.93037584230612	0.352539639046003	167	"P:maturation of 5.8S rRNA; P:somitogenesis; P:negative regulation of protein phosphorylation; P:activation of innate immune response; P:B cell lineage commitment; P:pro-B cell differentiation; P:T cell lineage commitment; P:brain development; P:heart development; P:intrinsic apoptotic signaling pathway in response to DNA damage; P:response to gamma radiation; P:telomere capping; P:peptidyl-serine phosphorylation; P:peptidyl-threonine phosphorylation; P:mitotic G1 DNA damage checkpoint signaling; P:protein destabilization; P:cellular response to insulin stimulus; P:T cell differentiation in thymus; P:immunoglobulin V(D)J recombination; P:T cell receptor V(D)J recombination; P:small-subunit processome assembly; P:ectopic germ cell programmed cell death; P:regulation of circadian rhythm; P:positive regulation of apoptotic process; P:negative regulation of apoptotic process; P:positive regulation of lymphocyte differentiation; P:positive regulation of erythrocyte differentiation; P:positive regulation of translation; P:positive regulation of transcription by RNA polymerase II; P:regulation of smooth muscle cell proliferation; P:regulation of epithelial cell proliferation; P:regulation of hematopoietic stem cell differentiation; P:positive regulation of platelet formation; P:positive regulation of double-strand break repair via nonhomologous end joining; double-stranded DNA binding; DNA-dependent protein kinase activity; enzyme binding; protein domain specific binding; U3 snoRNA binding; RNA polymerase II-specific DNA-binding transcription factor binding; nucleoplasm; transcription regulator complex; nucleolus; DNA-dependent protein kinase-DNA ligase 4 complex; small-subunit processome; protein-DNA complex; DNA-dependent protein kinase complex"	"GO:0000460; GO:0001756; GO:0001933; GO:0002218; GO:0002326; GO:0002328; GO:0002360; GO:0007420; GO:0007507; GO:0008630; GO:0010332; GO:0016233; GO:0018105; GO:0018107; GO:0031571; GO:0031648; GO:0032869; GO:0033077; GO:0033152; GO:0033153; GO:0034462; GO:0035234; GO:0042752; GO:0043065; GO:0043066; GO:0045621; GO:0045648; GO:0045727; GO:0045944; GO:0048660; GO:0050678; GO:1902036; GO:1905221; GO:2001034; GO:0003690; GO:0004677; GO:0019899; GO:0019904; GO:0034511; GO:0061629; GO:0005654; GO:0005667; GO:0005730; GO:0005958; GO:0032040; GO:0032993; GO:0070418"
"Pastreoides05689"	0.0103441899361915	0.405708256900212	0.121376043396442	2.48741954695406e-05	0.973592605681517	0.0606523706786803	0.859976523747693	1247	"protein binding; P:biological; process; molecular; function; calcium ion binding; metal ion binding; cellular; component"	"GO:0005515; GO:0008150; GO:0003674; GO:0005509; GO:0046872; GO:0005575"
"Pastreoides14246"	0.010381987544888	0.559431934575804	0.876679300720008	0.810318896709876	0.79032818358809	0.538140852481603	0.77865842067539	295	"extracellular region; P:positive regulation of epithelial cell migration; P:positive regulation of epithelial to mesenchymal transition; P:fatty acid transport; P:sterol transport; P:positive regulation of ERK1 and ERK2 cascade; magnesium ion binding; fatty acid binding; cholesterol binding; protein homodimerization activity; Golgi membrane; extracellular space; cell periphery"	"GO:0005576; GO:0010634; GO:0010718; GO:0015908; GO:0015918; GO:0070374; GO:0000287; GO:0005504; GO:0015485; GO:0042803; GO:0000139; GO:0005615; GO:0071944"
"Pastreoides52058"	0.01074309832967	0.379644372175909	5.18466492593184e-14	0.314521512206996	0.948286228320213	0.689635264155285	0.064549552743049	602	"P:positive regulation of transcription from RNA polymerase II promoter in response to calcium ion; DNA-binding transcription factor activity; P:proteolysis; P:positive regulation of transcription from RNA polymerase II promoter in response to calcium ion; DNA-binding transcription factor activity; cysteine-type peptidase activity; P:proteolysis; P:positive regulation of transcription from RNA polymerase II promoter in response to calcium ion; DNA-binding transcription factor activity; cysteine-type peptidase activity"	"GO:0061400; GO:0003700; GO:0006508; GO:0061400; GO:0003700; GO:0008234; GO:0006508; GO:0061400; GO:0003700; GO:0008234"
"Pastreoides54811"	0.0107594736218958	0.494084190890865	0.87738258086544	0.599005983164098	0.8562529525669	0.94785547629422	0.408224849673374	129	""	""
"Pastreoides02051"	0.0109750730792358	0.498067452280368	0.00020070009935507	0.918941726537031	0.986610824600346	0.999931545357191	1	668	"P:regulation of transcription, DNA-templated; DNA-binding transcription factor activity; nucleus; P:negative regulation of transcription by RNA polymerase II; P:negative regulation of cell population proliferation; P:cerebellar Purkinje cell layer development; P:cerebellar granule cell differentiation; P:positive regulation of transcription by RNA polymerase II; P:astrocyte differentiation; P:lung epithelial cell differentiation; RNA polymerase II transcription regulatory region sequence-specific DNA binding; DNA-binding transcription activator activity, RNA polymerase II-specific; protein binding; nucleus; intracellular non-membrane-bounded organelle"	"GO:0006355; GO:0003700; GO:0005634; GO:0000122; GO:0008285; GO:0021680; GO:0021707; GO:0045944; GO:0048708; GO:0060487; GO:0000977; GO:0001228; GO:0005515; GO:0005634; GO:0043232"
"Pastreoides31908"	0.0109837671687116	0.721355749806969	0.934470452306225	0.796557819438046	0.95911631391934	0.892657832790516	0.288047379924787	176	"P:nervous system development; P:regulation of cellular process; P:response to stimulus; binding; kinase activity; cytoplasm; membrane-bounded organelle; intracellular organelle"	"GO:0007399; GO:0050794; GO:0050896; GO:0005488; GO:0016301; GO:0005737; GO:0043227; GO:0043229"
"Pastreoides05324"	0.0110605249422369	0.703040215531357	0.664570990989818	0.12791337239933	0.663678978562461	0.995258570988594	0.350812278852684	394	"oxidoreductase activity; oxidoreductase activity, acting on the aldehyde or oxo group of donors, NAD or NADP as acceptor; P:kidney development; P:liver development; P:optic cup morphogenesis involved in camera-type eye development; P:response to oxidative stress; P:midgut development; P:response to xenobiotic stimulus; P:gamma-aminobutyric acid biosynthetic process; P:fructosamine catabolic process; P:response to estradiol; P:response to retinoic acid; P:maintenance of lens transparency; P:retinol metabolic process; P:9-cis-retinoic acid biosynthetic process; P:positive regulation of apoptotic process; P:estrous cycle; P:response to ethanol; P:cellular detoxification of aldehyde; P:negative regulation of cold-induced thermogenesis; retinal dehydrogenase activity; 3-chloroallyl aldehyde dehydrogenase activity; benzaldehyde dehydrogenase (NAD+) activity; aminobutyraldehyde dehydrogenase activity; identical protein binding; NAD binding; 3-deoxyglucosone dehydrogenase activity; nucleus; cytosol; axon; synapse"	"GO:0016491; GO:0016620; GO:0001822; GO:0001889; GO:0002072; GO:0006979; GO:0007494; GO:0009410; GO:0009449; GO:0030392; GO:0032355; GO:0032526; GO:0036438; GO:0042572; GO:0042904; GO:0043065; GO:0044849; GO:0045471; GO:0110095; GO:0120163; GO:0001758; GO:0004028; GO:0018479; GO:0019145; GO:0042802; GO:0051287; GO:0106373; GO:0005634; GO:0005829; GO:0030424; GO:0045202"
"Pastreoides21356"	0.0112678099638505	0.0214324057687958	0.91803057005886	1.81819358528094e-06	0.697196255098998	0.731427309995322	1	138	"P:cytoskeleton organization; P:regulation of cell shape; P:cell migration; P:heart contraction; protein kinase binding; small GTPase binding; cytosol"	"GO:0007010; GO:0008360; GO:0016477; GO:0060047; GO:0019901; GO:0031267; GO:0005829"
"Pastreoides02046"	0.0113063837410584	0.8002301806909	4.71836622101405e-22	0.781652507309214	0.107575838406839	0.339879534821404	0.655990481615981	437	"P:cellular process"	"GO:0009987"
"Pastreoides48448"	0.0115656298236913	0.996692215618175	0.575475944426347	0.953532254652432	0.805473945181881	0.963719369210027	0.323246409956099	68	""	""
"Pastreoides13721"	0.0118525123316281	0.226803955877279	0.0030339443336784	0.930648211743174	0.960392443705682	0.710869131490965	0.753646424323175	416	""	""
"Pastreoides18749"	0.0119455027438685	0.0721388066121691	0.943512739092408	0.718541531715047	0.988699624980977	0.485278899999327	0.785295680173646	923	"P:G protein-coupled receptor signaling pathway; G protein-coupled receptor activity; integral component of membrane; P:ion transport; P:signal transduction; P:multicellular organismal process; P:positive regulation of biological process; P:regulation of biological quality; P:cellular response to organic substance; protein binding; plasma membrane"	"GO:0007186; GO:0004930; GO:0016021; GO:0006811; GO:0007165; GO:0032501; GO:0048518; GO:0065008; GO:0071310; GO:0005515; GO:0005886"
"Pastreoides14324"	0.012279176175271	0.00780535164082169	0.128324049433131	0.0345618024621958	0.340587758233255	0.966687406801316	0.876744861828396	606	""	""
"Pastreoides17711"	0.0124954525987079	0.273781016747571	0.974548546084661	0.315882249354407	0.718741575239739	1	0.965597269038596	906	"protein binding; P:chromatin remodeling; P:regulation of transcription by RNA polymerase II; P:male meiosis I; P:spermatogenesis; P:regulation of RNA splicing; P:positive regulation of transcription involved in meiotic cell cycle; transcription coactivator activity; lysine-acetylated histone binding; nucleus; chromosome"	"GO:0005515; GO:0006338; GO:0006357; GO:0007141; GO:0007283; GO:0043484; GO:0051039; GO:0003713; GO:0070577; GO:0005634; GO:0005694"
"Pastreoides45621"	0.0126756158870809	0.000533937423970627	0.305235109619133	0.24699639352929	0.565187517468253	0.736445336783291	0.403367040787801	468	"glycosyltransferase activity; transferase activity; transferase activity"	"GO:0016757; GO:0016740; GO:0016740"
"Pastreoides05932"	0.0128836480567525	0.497185950742865	0.852794479945301	1	1	0.86443605850576	1	340	"P:protein glycosylation; hexosyltransferase activity; membrane; P:glycosaminoglycan biosynthetic process; P:proteoglycan biosynthetic process; UDP-galactosyltransferase activity; membrane; Golgi cisterna"	"GO:0006486; GO:0016758; GO:0016020; GO:0006024; GO:0030166; GO:0035250; GO:0016020; GO:0031985"
"Pastreoides21497"	0.0130472475985232	0.991070741022568	0.558047996776023	0.738011311738009	0.748757343343036	0.63606080118549	0.532762540887801	227	"holocytochrome-c synthase activity; mitochondrion; P:animal organ morphogenesis; P:cytochrome c-heme linkage; holocytochrome-c synthase activity; protein binding; heme binding; mitochondrial inner membrane; cytosol"	"GO:0004408; GO:0005739; GO:0009887; GO:0018063; GO:0004408; GO:0005515; GO:0020037; GO:0005743; GO:0005829"
"Pastreoides37666"	0.0130891852235466	0.00188320698903937	0.0106907807179622	0.767631217171598	0.752631068130487	0.999042685330591	0.876744861828396	425	"oxidoreductase activity, acting on NAD(P)H; quinone binding; NAD binding; P:mitochondrial electron transport, NADH to ubiquinone; P:response to oxidative stress; P:mitochondrial respiratory chain complex I assembly; P:gliogenesis; P:neural precursor cell proliferation; P:cellular response to oxygen levels; NADH dehydrogenase (ubiquinone) activity; oxygen sensor activity; ubiquitin protein ligase binding; metal ion binding; quinone binding; NAD binding; 4 iron, 4 sulfur cluster binding; nucleoplasm; mitochondrial respiratory chain complex I"	"GO:0016651; GO:0048038; GO:0051287; GO:0006120; GO:0006979; GO:0032981; GO:0042063; GO:0061351; GO:0071453; GO:0008137; GO:0019826; GO:0031625; GO:0046872; GO:0048038; GO:0051287; GO:0051539; GO:0005654; GO:0005747"
"Pastreoides26718"	0.0131046480239535	0.996692215618175	0.336475088799153	0.950284932970499	0.986103170516052	0.999931545357191	0.959182955975158	435	"P:calcium ion transport; P:response to stress; P:response to temperature stimulus; P:detection of external stimulus; P:detection of abiotic stimulus; P:response to organic substance; P:sensory perception of pain; P:positive regulation of biological process; P:regulation of cellular process; P:detection of stimulus involved in sensory perception; P:regulation of biological quality; P:cellular response to chemical stimulus; P:cation transmembrane transport; cation channel activity; gated channel activity; membrane"	"GO:0006816; GO:0006950; GO:0009266; GO:0009581; GO:0009582; GO:0010033; GO:0019233; GO:0048518; GO:0050794; GO:0050906; GO:0065008; GO:0070887; GO:0098655; GO:0005261; GO:0022836; GO:0016020"
"Pastreoides23109"	0.0131127273864092	0.770875665411115	0.949621289958543	0.00863884960981273	0.936561914718786	0.41692121639235	0.589610328259859	644	"protein binding; P:regulation of transcription, DNA-templated; P:positive regulation of macromolecule metabolic process; P:positive regulation of cellular metabolic process; P:negative regulation of cellular process; P:positive regulation of nitrogen compound metabolic process; transcription coregulator activity; histone binding; nucleus; cytoplasm"	"GO:0005515; GO:0006355; GO:0010604; GO:0031325; GO:0048523; GO:0051173; GO:0003712; GO:0042393; GO:0005634; GO:0005737"
"Pastreoides11973"	0.0131264171181356	0.953609439112786	0.538403773366657	0.491105087751051	0.36309409425922	0.706891400572898	1	296	"P:signal transduction; guanyl-nucleotide exchange factor activity; P:regulation of catalytic activity; P:regulation of small GTPase mediated signal transduction; guanyl-nucleotide exchange factor activity; P:regulation of catalytic activity; P:regulation of small GTPase mediated signal transduction; guanyl-nucleotide exchange factor activity"	"GO:0007165; GO:0005085; GO:0050790; GO:0051056; GO:0005085; GO:0050790; GO:0051056; GO:0005085"
"Pastreoides21370"	0.0134412011808505	0.751603970111572	0.870807879473949	0.475765726325116	0.826492182081051	1	0.809868137932032	319	"P:arachidonic acid metabolic process; P:regulation of axon extension; P:positive regulation of vasoconstriction; P:regulation of inflammatory response; P:regulation of sensory perception of pain; P:monoacylglycerol catabolic process; P:long-term synaptic depression; P:regulation of endocannabinoid signaling pathway; lysophospholipase activity; protein homodimerization activity; acylglycerol lipase activity; nucleoplasm; endoplasmic reticulum membrane; lipid droplet; cytosol; plasma membrane; extrinsic component of membrane; varicosity; synapse"	"GO:0019369; GO:0030516; GO:0045907; GO:0050727; GO:0051930; GO:0052651; GO:0060292; GO:2000124; GO:0004622; GO:0042803; GO:0047372; GO:0005654; GO:0005789; GO:0005811; GO:0005829; GO:0005886; GO:0019898; GO:0043196; GO:0045202"
"Pastreoides00543"	0.0137916524933455	0.837493479132477	0.98999806677007	0.937776649723736	0.811079502288702	0.344840121545699	1	554	"P:signal transduction; P:regulation of apoptotic process; protein binding; zinc ion binding; metal ion binding; P:positive regulation of protein phosphorylation; P:toll-like receptor signaling pathway; P:regulation of production of molecular mediator of immune response; P:positive regulation of gene expression; P:protein ubiquitination; P:regulation of proteolysis; P:negative regulation of N-kappaB transcription factor activity; P:regulation of interferon-beta production; P:tumor necrosis factor-mediated signaling pathway; P:regulation of apoptotic process; P:regulation of I-kappaB kinase/N-kappaB signaling; P:regulation of JNK cascade; P:negative regulation of cellular process; P:regulation of defense response to virus; P:positive regulation of DNA-binding transcription factor activity; P:positive regulation of intracellular signal transduction; tumor necrosis factor receptor binding; transferase activity; protein kinase binding; protein phosphatase binding; ubiquitin protein ligase binding; thioesterase binding; identical protein binding; cytoplasm; cytoplasmic side of plasma membrane; endomembrane system; organelle membrane; vesicle; D40 receptor complex; intracellular membrane-bounded organelle"	"GO:0007165; GO:0042981; GO:0005515; GO:0008270; GO:0046872; GO:0001934; GO:0002224; GO:0002700; GO:0010628; GO:0016567; GO:0030162; GO:0032088; GO:0032648; GO:0033209; GO:0042981; GO:0043122; GO:0046328; GO:0048523; GO:0050688; GO:0051091; GO:1902533; GO:0005164; GO:0016740; GO:0019901; GO:0019903; GO:0031625; GO:0031996; GO:0042802; GO:0005737; GO:0009898; GO:0012505; GO:0031090; GO:0031982; GO:0035631; GO:0043231"
"Pastreoides05827"	0.013914735335271	0.0258483367393658	3.5543470294363e-08	0.884815272669927	0.929921245683885	0.874933192861451	0.33174954594222	1414	"P:endosome organization; P:regulation of early endosome to late endosome transport; P:receptor-mediated endocytosis; P:endosome organization; P:response to external stimulus; P:protein transport; P:multicellular organismal process; P:developmental process; P:regulation of early endosome to recycling endosome transport; P:regulation of early endosome to late endosome transport; protein binding; cytosol; plasma membrane; early endosome membrane; azurophil granule membrane; WASH complex"	"GO:0007032; GO:2000641; GO:0006898; GO:0007032; GO:0009605; GO:0015031; GO:0032501; GO:0032502; GO:1902954; GO:2000641; GO:0005515; GO:0005829; GO:0005886; GO:0031901; GO:0035577; GO:0071203"
"Pastreoides15536"	0.0139700217059319	0.524824716889145	0.000365297413452513	1	0.485612103677044	0.64329147764724	1	1836	"P:kidney development; protein binding; integral component of membrane; P:cation transport; P:response to abiotic stimulus; P:cellular process; P:sensory perception of sour taste; P:detection of stimulus; cation channel activity; protein binding; cation channel complex; cell projection"	"GO:0001822; GO:0005515; GO:0016021; GO:0006812; GO:0009628; GO:0009987; GO:0050915; GO:0051606; GO:0005261; GO:0005515; GO:0034703; GO:0042995"
"Pastreoides46399"	0.0140012143797618	0.0533248764003713	0.633279655904228	0.0604648149875184	0.966945087400214	0.66760282939894	0.778376102085625	295	"P:negative regulation of fat cell differentiation; protein binding; centrosome"	"GO:0045599; GO:0005515; GO:0005813"
"Pastreoides07074"	0.0140515515986431	0.936536674160064	0.0497805568245581	0.373001706930032	0.69164632289311	0.669596279376854	0.526677856648715	350	"P:mRNA cis splicing, via spliceosome; nucleic acid binding; P:regulation of alternative mRNA splicing, via spliceosome; P:mRNA splice site selection; nucleic acid binding; nucleus; protein-containing complex"	"GO:0045292; GO:0003676; GO:0000381; GO:0006376; GO:0003676; GO:0005634; GO:0032991"
"Pastreoides13668"	0.0140535823151177	0.612506799197828	3.61070436916409e-10	0.000721128074872481	0.800409527409979	0.778686328849324	1	110	"P:signal transduction; P:G protein-coupled receptor signaling pathway; G protein-coupled receptor activity; membrane; integral component of membrane; P:signal transduction; P:G protein-coupled receptor signaling pathway; G protein-coupled receptor activity; membrane; integral component of membrane"	"GO:0007165; GO:0007186; GO:0004930; GO:0016020; GO:0016021; GO:0007165; GO:0007186; GO:0004930; GO:0016020; GO:0016021"
"Pastreoides36084"	0.0142299887233	0.781490106466916	0.837523722710532	0.331980243977862	0.631212881882656	0.934110192690943	1	748	"protein binding; oxidoreductase activity, acting on single donors with incorporation of molecular oxygen, incorporation of two atoms of oxygen; metal ion binding; P:negative regulation of endothelial cell proliferation; P:leukocyte chemotaxis involved in inflammatory response; P:acute inflammatory response; P:leukotriene production involved in inflammatory response; P:humoral immune response; P:response to nutrient; P:sensory perception of pain; P:positive regulation of bone mineralization; P:dendritic cell migration; P:glucose homeostasis; P:long-chain fatty acid biosynthetic process; P:regulation of fat cell differentiation; P:positive regulation of vasoconstriction; P:negative regulation of inflammatory response; P:regulation of insulin secretion; P:response to hyperoxia; P:negative regulation of vascular wound healing; P:regulation of inflammatory response to wounding; P:regulation of cytokine production involved in inflammatory response; P:regulation of cellular response to oxidative stress; P:leukotriene A4 biosynthetic process; P:regulation of reactive oxygen species biosynthetic process; P:negative regulation of response to endoplasmic reticulum stress; P:negative regulation of sprouting angiogenesis; P:positive regulation of cytochrome-c oxidase activity; P:positive regulation of leukocyte adhesion to arterial endothelial cell; P:lipoxin biosynthetic process; arachidonate 5-lipoxygenase activity; iron ion binding; protein binding; extracellular region; nuclear envelope lumen; nucleoplasm; cytosol; nuclear matrix; secretory granule; dendrite; nuclear membrane; sarcolemma; perinuclear region of cytoplasm"	"GO:0005515; GO:0016702; GO:0046872; GO:0001937; GO:0002232; GO:0002526; GO:0002540; GO:0006959; GO:0007584; GO:0019233; GO:0030501; GO:0036336; GO:0042593; GO:0042759; GO:0045598; GO:0045907; GO:0050728; GO:0050796; GO:0055093; GO:0061044; GO:0106014; GO:1900015; GO:1900407; GO:1901753; GO:1903426; GO:1903573; GO:1903671; GO:1904960; GO:1904999; GO:2001301; GO:0004051; GO:0005506; GO:0005515; GO:0005576; GO:0005641; GO:0005654; GO:0005829; GO:0016363; GO:0030141; GO:0030425; GO:0031965; GO:0042383; GO:0048471"
"Pastreoides17563"	0.014316052414219	0.739468815805331	0.597213218820933	0.404443476148498	0.128627951368731	0.727726612193762	0.253310381440865	160	""	""
"Pastreoides26449"	0.0148291509922012	0.998259026967119	0.907723797751738	0.960988851395785	0.19436334518886	0.556476092081901	1	616	"acyltransferase activity; P:generation of precursor metabolites and energy; P:fatty acid beta-oxidation; P:response to xenobiotic stimulus; P:carnitine metabolic process; P:response to organonitrogen compound; P:fatty acid transport; P:coenzyme A metabolic process; P:medium-chain fatty acid metabolic process; protein binding; carnitine O-octanoyltransferase activity; peroxisome"	"GO:0016746; GO:0006091; GO:0006635; GO:0009410; GO:0009437; GO:0010243; GO:0015908; GO:0015936; GO:0051791; GO:0005515; GO:0008458; GO:0005777"
"Pastreoides49552"	0.0150645820711037	0.170238109067941	0.457315725820992	6.31822219139961e-09	0.537719153140766	0.768231113882127	0.702296204241449	346	"hydro-lyase activity"	"GO:0016836"
"Pastreoides63809"	0.0153763958160124	0.817305659750136	0.118208770142098	0.911267754573599	0.976492539521251	0.706891400572898	0.982611431606068	484	"P:DNA replication; P:cellular macromolecule metabolic process; P:DNA biosynthetic process; nucleotide binding; nucleic acid binding; DNA binding; DNA-directed DNA polymerase activity; P:DNA replication; P:cellular macromolecule metabolic process; P:DNA biosynthetic process; nucleotide binding; nucleic acid binding; DNA binding; DNA-directed DNA polymerase activity"	"GO:0006260; GO:0044260; GO:0071897; GO:0000166; GO:0003676; GO:0003677; GO:0003887; GO:0006260; GO:0044260; GO:0071897; GO:0000166; GO:0003676; GO:0003677; GO:0003887"
"Pastreoides43020"	0.0154532614130412	0.423711361161229	0.73220073670827	0.304463933211676	0.0227900689713362	0.963719369210027	0.831445542305764	933	"copper ion binding; oxidoreductase activity; P:transition metal ion transport; oxidoreductase activity; transition metal ion binding; plasma membrane"	"GO:0005507; GO:0016491; GO:0000041; GO:0016491; GO:0046914; GO:0005886"
