"gene"	"adj.pval.Origin"	"adj.pval.Treatment"	"adj.pval.LifeStage"	"adj.pval.Origin_x_Treatment"	"adj.pval.Origin_x_LifeStage"	"adj.pval.Treatment_x_LifeStage"	"adj.pval.Origin_x_Treatment_x_LifeStage"	"Length"	"GO_Name"	"GO_IDs"
"Pastreoides32833"	1.35091303451294e-10	0.951154349667533	0.952468122915206	0.041532024976632	0.778968208287917	0.970968850229351	0.782963811313814	307	"membrane; P:mitophagy; P:positive regulation of immunoglobulin production; P:protein import into nucleus; P:sister chromatid cohesion; P:activation of phospholipase  activity; P:response to wounding; P:cell migration; P:D40 signaling pathway; P:positive regulation of exit from mitosis; P:negative regulation of intracellular estrogen receptor signaling pathway; P:negative regulation of mammary gland epithelial cell proliferation; P:induction by virus of host autophagy; P:RIG-I signaling pathway; P:B cell activation; P:negative regulation of apoptotic process; P:negative regulation of DNA-binding transcription factor activity; P:negative regulation of transcription, DNA-templated; P:protein stabilization; P:positive regulation of DNA-binding transcription factor activity; P:mammary gland branching involved in thelarche; P:mammary gland alveolus development; P:regulation of branching involved in mammary gland duct morphogenesis; P:positive regulation of ERK1 and ERK2 cascade; P:cellular response to retinoic acid; P:cellular response to hypoxia; P:antiviral innate immune response; P:regulation of cardiolipin metabolic process; P:positive regulation of NIK/N-kappaB signaling; P:positive regulation of cell cycle G1/S phase transition; P:regulation of cytochrome-c oxidase activity; P:activation of protein kinase  activity; protein -terminus binding; amide binding; protein homodimerization activity; sphingolipid binding; protein heterodimerization activity; protein N-terminus binding; mitochondrial outer membrane; plasma membrane; cell surface; postsynaptic density; nuclear matrix; axon; mitochondrial prohibitin complex; presynaptic active zone; glutamatergic synapse; GABA-ergic synapse"	"GO:0016020; GO:0000423; GO:0002639; GO:0006606; GO:0007062; GO:0007202; GO:0009611; GO:0016477; GO:0023035; GO:0031536; GO:0033147; GO:0033600; GO:0039520; GO:0039529; GO:0042113; GO:0043066; GO:0043433; GO:0045892; GO:0050821; GO:0051091; GO:0060744; GO:0060749; GO:0060762; GO:0070374; GO:0071300; GO:0071456; GO:0140374; GO:1900208; GO:1901224; GO:1902808; GO:1904959; GO:1990051; GO:0008022; GO:0033218; GO:0042803; GO:0046625; GO:0046982; GO:0047485; GO:0005741; GO:0005886; GO:0009986; GO:0014069; GO:0016363; GO:0030424; GO:0035632; GO:0048786; GO:0098978; GO:0098982"
"Pastreoides31689"	1.53717603163684e-10	0.000868136070808258	0.359533674928477	0.72524199101094	0.580574237399307	0.418703761920882	0.064549552743049	502	"P:ubiquinone biosynthetic process; 2-octaprenyl-6-methoxyphenol hydroxylase activity; oxidoreductase activity, acting on paired donors, with incorporation or reduction of molecular oxygen, NAD(P)H as one donor, and incorporation of one atom of oxygen; flavin adenine dinucleotide binding; AD binding; P:ubiquinone biosynthetic process; monooxygenase activity; protein binding; oxidoreductase activity, acting on paired donors, with incorporation or reduction of molecular oxygen; mitochondrial inner membrane; ubiquinone biosynthesis complex"	"GO:0006744; GO:0008681; GO:0016709; GO:0050660; GO:0071949; GO:0006744; GO:0004497; GO:0005515; GO:0016705; GO:0005743; GO:0110142"
"Pastreoides41676"	2.31745520272114e-10	1.81202689602179e-11	3.55763744613015e-06	0.0040347698344036	0.305538147145743	0.513426083048005	0.898016675831213	134	""	""
"Pastreoides27287"	2.41158905171801e-10	0.526646922397613	1.54397534701196e-05	0.4572144235524	0.457651200186267	0.346409990783604	0.0564815464962649	870	""	""
"Pastreoides24713"	2.5111749784963e-10	9.22505412890761e-11	3.08387621789594e-06	4.05918999923729e-24	0.726934430610742	0.984183975173933	0.532762540887801	400	"P:skeletal system development; P:collagen fibril organization; P:skin development; P:eye morphogenesis; P:cellular response to amino acid stimulus; extracellular region; collagen type V trimer"	"GO:0001501; GO:0030199; GO:0043588; GO:0048592; GO:0071230; GO:0005576; GO:0005588"
"Pastreoides23340"	2.59614526552521e-10	2.36531386195539e-48	0.857660838739215	0.00071597061229783	0.550751378647391	0.913944703813315	0.422658896689045	1923	"P:ion transport; P:transmembrane transport; P:calcium ion transmembrane transport; ion channel activity; voltage-gated calcium channel activity; cation channel activity; plasma membrane; voltage-gated calcium channel complex; membrane; P:immune system development; P:chemical synaptic transmission; P:heart development; P:adult walking behavior; P:regulation of blood pressure; P:visual learning; P:regulation of cardiac muscle contraction by regulation of the release of sequestered calcium ion; P:neuron remodeling; P:calcium-ion regulated exocytosis; P:regulation of vasoconstriction; P:insulin secretion; P:growth hormone secretion; P:embryonic forelimb morphogenesis; P:locomotion; P:epithelial fluid transport; P:glucose homeostasis; P:camera-type eye development; P:positive regulation of adenylate cyclase activity; P:regulation of organ growth; P:smooth muscle contraction involved in micturition; P:membrane depolarization during AV node cell action potential; P:regulation of heart rate by cardiac conduction; P:calcium ion import across plasma membrane; P:regulation of membrane repolarization during action potential; P:regulation of ventricular cardiac muscle cell action potential; P:membrane depolarization during atrial cardiac muscle cell action potential; P:positive regulation of calcium ion transmembrane transport via high voltage-gated calcium channel; calmodulin binding; high voltage-gated calcium channel activity; protein domain specific binding; translation initiation factor binding; transmembrane transporter binding; alpha-actinin binding; protein phosphatase 2A binding; voltage-gated calcium channel activity involved in AV node cell action potential; voltage-gated ion channel activity involved in regulation of postsynaptic membrane potential; caveolar macromolecular signaling complex; cell surface; postsynaptic density; basolateral plasma membrane; apical plasma membrane; Z disc; neuronal cell body; dendritic shaft; glutamatergic synapse; integral component of postsynaptic membrane; integral component of presynaptic membrane; L-type voltage-gated calcium channel complex"	"GO:0006811; GO:0055085; GO:0070588; GO:0005216; GO:0005245; GO:0005261; GO:0005886; GO:0005891; GO:0016020; GO:0002520; GO:0007268; GO:0007507; GO:0007628; GO:0008217; GO:0008542; GO:0010881; GO:0016322; GO:0017156; GO:0019229; GO:0030073; GO:0030252; GO:0035115; GO:0040011; GO:0042045; GO:0042593; GO:0043010; GO:0045762; GO:0046620; GO:0060083; GO:0086045; GO:0086091; GO:0098703; GO:0098903; GO:0098911; GO:0098912; GO:1904879; GO:0005516; GO:0008331; GO:0019904; GO:0031369; GO:0044325; GO:0051393; GO:0051721; GO:0086056; GO:1905030; GO:0002095; GO:0009986; GO:0014069; GO:0016323; GO:0016324; GO:0030018; GO:0043025; GO:0043198; GO:0098978; GO:0099055; GO:0099056; GO:1990454"
"Pastreoides25728"	2.79431285857894e-10	0.825861853792762	0.960616751564835	0.0273354187289417	0.994873332757403	0.97050246987526	0.958065096439555	281	"binding; nuclear lumen; intracellular non-membrane-bounded organelle"	"GO:0005488; GO:0031981; GO:0043232"
"Pastreoides15527"	3.32949254771857e-10	0.000591950392173379	0.247250706043952	0.939033506213756	0.161161379974486	0.659405683997896	0.958065096439555	972	"catalytic activity; catalytic activity"	"GO:0003824; GO:0003824"
"Pastreoides28138"	3.93750783919372e-10	0.288498661955144	0.670968809642305	0.201551595347268	0.87050161096907	0.4053347724425	0.897986233757896	278	"nucleotide binding; RNA binding; RNA helicase activity; hydrolase activity; ion binding; intracellular anatomical structure"	"GO:0000166; GO:0003723; GO:0003724; GO:0016787; GO:0043167; GO:0005622"
"Pastreoides35195"	4.33789053506357e-10	0.00758814476303549	4.19279943256199e-06	0.00032554833041081	0.501492638217655	0.678096998341861	0.472549239551346	91	"P:DNA replication; nucleotide binding; DNA binding; DNA-directed DNA polymerase activity; P:transmembrane transport; transmembrane transporter activity; membrane; integral component of membrane; P:transmembrane transport; transmembrane transporter activity; membrane; integral component of membrane"	"GO:0006260; GO:0000166; GO:0003677; GO:0003887; GO:0055085; GO:0022857; GO:0016020; GO:0016021; GO:0055085; GO:0022857; GO:0016020; GO:0016021"
"Pastreoides13806"	4.76450137526282e-10	0.293940065579055	0.660238662048359	0.00018716944501378	0.122652597147068	0.0859922581479115	0.00882376920291172	203	"protein binding"	"GO:0005515"
"Pastreoides16648"	5.33793110150556e-10	1.04814850761054e-05	0.663570119003141	0.00597758012092284	0.284685089791581	0.623230992393316	0.890039047323062	302	"P:cGMP biosynthetic process; P:cyclic nucleotide biosynthetic process; P:intracellular signal transduction; guanylate cyclase activity; phosphorus-oxygen lyase activity; P:cGMP biosynthetic process; P:blood circulation; P:nitric oxide-cGMP-mediated signaling pathway; P:cellular response to nitric oxide; P:trans-synaptic signaling by nitric oxide, modulating synaptic transmission; nucleotide binding; adenylate cyclase activity; guanylate cyclase activity; heme binding; signaling receptor activity; ion binding; protein-containing complex binding; cytidylate cyclase activity; Hsp90 protein binding; guanylate cyclase complex, soluble; presynaptic active zone cytoplasmic component; glutamatergic synapse"	"GO:0006182; GO:0009190; GO:0035556; GO:0004383; GO:0016849; GO:0006182; GO:0008015; GO:0038060; GO:0071732; GO:0099555; GO:0000166; GO:0004016; GO:0004383; GO:0020037; GO:0038023; GO:0043167; GO:0044877; GO:0047805; GO:0051879; GO:0008074; GO:0098831; GO:0098978"
"Pastreoides42462"	5.69043013755861e-10	0.860400308084893	0.0540063184168609	0.392512449430105	0.949768211306854	0.144894624859976	0.621236307544784	415	"P:carbohydrate metabolic process; magnesium ion binding; intramolecular transferase activity, phosphotransferases; P:gluconeogenesis; P:glycolytic process; magnesium ion binding; phosphoglucomutase activity; protein binding; extracellular region; cytosol; sarcoplasmic reticulum; tertiary granule lumen; ficolin-1-rich granule lumen"	"GO:0005975; GO:0000287; GO:0016868; GO:0006094; GO:0006096; GO:0000287; GO:0004614; GO:0005515; GO:0005576; GO:0005829; GO:0016529; GO:1904724; GO:1904813"
"Pastreoides21101"	8.68081378321015e-10	0.0352119722898898	0.000316219418145924	0.000193186652852688	0.960392443705682	0.530452589107308	0.555166339486879	1151	""	""
"Pastreoides04556"	8.83537000348614e-10	1.8203623958666e-07	0.463300837822393	0.000408205987705241	0.934755224127087	0.801987351657556	0.83585524765631	157	"P:DNA-templated transcription, termination; P:DNA-templated transcription, termination"	"GO:0006353; GO:0006353"
"Pastreoides08215"	1.01419738089188e-09	0.0521680760289017	0.972770530940525	0.068070263902095	0.936433257148871	0.35825142936747	1	258	"P:DNA replication; P:DNA biosynthetic process; nucleotide binding; DNA binding; DNA-directed DNA polymerase activity; P:DNA replication; P:DNA biosynthetic process; nucleotide binding; DNA binding; DNA-directed DNA polymerase activity"	"GO:0006260; GO:0071897; GO:0000166; GO:0003677; GO:0003887; GO:0006260; GO:0071897; GO:0000166; GO:0003677; GO:0003887"
"Pastreoides28610"	1.06286725244761e-09	0.86120487552992	0.000446272114599106	3.29731417577974e-24	0.917693843664586	0.447132347022779	0.0521173056126612	191	""	""
"Pastreoides15609"	1.14834712717259e-09	1.5458500314794e-37	0.663058425377619	0.907288192566298	0.239953310433978	0.409391290940933	0.385421928436746	1008	"P:regulation of transcription by RNA polymerase II; double-stranded DNA binding; protein dimerization activity; nucleus; P:negative regulation of transcription by RNA polymerase II; P:regulation of gene expression, epigenetic; double-stranded DNA binding; identical protein binding; DNA-binding transcription factor binding; nucleoplasm"	"GO:0006357; GO:0003690; GO:0046983; GO:0005634; GO:0000122; GO:0040029; GO:0003690; GO:0042802; GO:0140297; GO:0005654"
"Pastreoides57119"	1.1792858551885e-09	0.970723436199729	0.0289223618257954	0.00121363423130729	0.565033384006584	0.355451646451774	0.408269354965015	702	"nucleic acid binding; zinc ion binding; nucleic acid binding; zinc ion binding; nucleic acid binding; zinc ion binding"	"GO:0003676; GO:0008270; GO:0003676; GO:0008270; GO:0003676; GO:0008270"
"Pastreoides02382"	1.2062801533373e-09	0.0396369304224031	1.98590693752434e-41	0.161940938379107	0.601693982969203	0.727726612193762	0.000106056827588976	208	"P:mRNA catabolic process; exonuclease activity; organic cyclic compound binding; catalytic activity, acting on RNA; heterocyclic compound binding; intracellular anatomical structure"	"GO:0006402; GO:0004527; GO:0097159; GO:0140098; GO:1901363; GO:0005622"
"Pastreoides33741"	1.41889061477891e-09	0.018276743656268	5.07408742634461e-07	2.99419646828282e-12	0.770263567038519	0.0207985233530756	0.253310381440865	565	"P:DNA replication; P:DNA biosynthetic process; nucleotide binding; nucleic acid binding; DNA binding; DNA-directed DNA polymerase activity; P:DNA replication; P:DNA biosynthetic process; nucleotide binding; nucleic acid binding; DNA binding; DNA-directed DNA polymerase activity"	"GO:0006260; GO:0071897; GO:0000166; GO:0003676; GO:0003677; GO:0003887; GO:0006260; GO:0071897; GO:0000166; GO:0003676; GO:0003677; GO:0003887"
"Pastreoides57603"	1.43573486980185e-09	5.82678087646822e-10	0.740861680505698	0.00018716944501378	0.146578594583392	0.886694982161332	0.823314557512999	460	"P:defense response to insect; P:L-serine catabolic process; P:threonine catabolic process; P:isoleucine biosynthetic process; P:response to insect; P:positive regulation of defense response; P:protein homotetramerization; P:D-serine metabolic process; P:response to herbivore; nucleotide binding; L-serine ammonia-lyase activity; L-threonine ammonia-lyase activity; D-serine ammonia-lyase activity; serine racemase activity; identical protein binding; anion binding; protein self-association; metal ion binding"	"GO:0002213; GO:0006565; GO:0006567; GO:0009097; GO:0009625; GO:0031349; GO:0051289; GO:0070178; GO:0080027; GO:0000166; GO:0003941; GO:0004794; GO:0008721; GO:0030378; GO:0042802; GO:0043168; GO:0043621; GO:0046872"
"Pastreoides30376"	1.63508961462139e-09	0.000495727984466464	0.156175634857793	0.518580895848935	0.646058742419423	0.862803995692344	0.689970790627952	323	"P:metal ion transport; P:transmembrane transport; metal ion transmembrane transporter activity; membrane; P:ion transport; protein binding"	"GO:0030001; GO:0055085; GO:0046873; GO:0016020; GO:0006811; GO:0005515"
"Pastreoides12729"	1.94361276436063e-09	6.46758744265151e-09	5.28180410466326e-07	0.133102044584112	0.261949746574135	0.756178450433024	0.548703285079206	1076	"P:negative regulation of transcription by RNA polymerase II; P:cell adhesion; P:homophilic cell adhesion via plasma membrane adhesion molecules; P:embryo implantation; protein binding; nucleus; host cell cytoplasm; intrinsic component of plasma membrane"	"GO:0000122; GO:0007155; GO:0007156; GO:0007566; GO:0005515; GO:0005634; GO:0030430; GO:0031226"
"Pastreoides12731"	1.94361276436063e-09	6.46758744265151e-09	5.28180410466326e-07	0.133102044584112	0.261949746574135	0.756178450433024	0.548703285079206	797	"P:DNA-templated transcription, initiation; P:regulation of transcription by RNA polymerase III; P:metabolic process; P:cellular response to oxidative stress; P:transcription preinitiation complex assembly; RNA polymerase III type 3 promoter sequence-specific DNA binding; exo-alpha-sialidase activity; protein binding; hydrolase activity; hydrolase activity, acting on glycosyl bonds; TBP-class protein binding; metal ion binding; exo-alpha-(2->3)-sialidase activity; exo-alpha-(2->6)-sialidase activity; exo-alpha-(2->8)-sialidase activity; transcription factor TIIIB complex; nucleus; plasma membrane; membrane; integral component of membrane; host cell cytoplasm; anchored component of membrane; transcription preinitiation complex"	"GO:0006352; GO:0006359; GO:0008152; GO:0034599; GO:0070897; GO:0001006; GO:0004308; GO:0005515; GO:0016787; GO:0016798; GO:0017025; GO:0046872; GO:0052794; GO:0052795; GO:0052796; GO:0000126; GO:0005634; GO:0005886; GO:0016020; GO:0016021; GO:0030430; GO:0031225; GO:0097550"
"Pastreoides09553"	2.09740546641468e-09	0.754311509291567	0.933814668934626	0.263560978755015	0.905450188228358	0.962288321047454	0.345301827041774	291	"protein serine/threonine kinase activity; P:autophagy of mitochondrion; P:signal transduction; P:axon guidance; P:determination of adult lifespan; P:embryo development ending in birth or egg hatching; P:positive regulation of autophagy; P:programmed cell death; P:regulation of macroautophagy; P:cell migration; P:peptidyl-amino acid modification; P:regulation of axon extension; P:hindbrain development; P:cellular response to nutrient levels; P:regulation of protein localization; P:cellular response to stress; P:regulation of multicellular organism growth; P:dauer larval development; P:response to starvation; P:apoptotic cell clearance; P:regulation of cellular component biogenesis; P:nematode male tail tip morphogenesis; P:protein autophosphorylation; P:negative regulation of collateral sprouting; P:regulation of macromolecule metabolic process; P:selective autophagy; protein serine/threonine kinase activity; GTPase binding; autophagosome; endomembrane system; axon; extrinsic component of organelle membrane; cytoplasmic vesicle; phagophore assembly site membrane; neuronal cell body; bounding membrane of organelle"	"GO:0004674; GO:0000422; GO:0007165; GO:0007411; GO:0008340; GO:0009792; GO:0010508; GO:0012501; GO:0016241; GO:0016477; GO:0018193; GO:0030516; GO:0030902; GO:0031669; GO:0032880; GO:0033554; GO:0040014; GO:0040024; GO:0042594; GO:0043277; GO:0044087; GO:0045138; GO:0046777; GO:0048671; GO:0060255; GO:0061912; GO:0004674; GO:0051020; GO:0005776; GO:0012505; GO:0030424; GO:0031312; GO:0031410; GO:0034045; GO:0043025; GO:0098588"
"Pastreoides17804"	2.39781919964158e-09	0.721355749806969	0.591496505515792	0.541339253868208	0.867979100255622	0.541361034380125	0.593179900237273	1934	"cytoskeletal motor activity; ATP binding; actin filament binding; myosin complex; P:mitotic cytokinesis; P:in utero embryonic development; P:neuron migration; P:plasma membrane repair; P:cardiac septum development; P:exocytosis; P:substrate-dependent cell migration, cell extension; P:nuclear migration; P:cell adhesion; P:axon guidance; P:adult heart development; P:cell population proliferation; P:regulation of cell shape; P:fourth ventricle development; P:lateral ventricle development; P:third ventricle development; P:cerebellar Purkinje cell layer development; P:actin filament-based movement; P:aorta development; P:positive regulation of protein secretion; P:neuromuscular process controlling balance; P:actin filament bundle assembly; P:cardiac myofibril assembly; P:ventricular cardiac muscle cell development; P:retina development in camera-type eye; P:coronary vasculature development; P:actin filament bundle distribution; P:postsynaptic actin cytoskeleton organization; P:regulation of modification of postsynaptic actin cytoskeleton; microfilament motor activity; magnesium ion binding; ATP binding; structural constituent of muscle; myosin light chain binding; RNA stem-loop binding; identical protein binding; ADP binding; myosin II binding; mRNA 5'-UTR binding; actin filament binding; stress fiber; spindle; cytosol; polysome; muscle myosin complex; brush border; cell cortex; cytoplasmic side of plasma membrane; lamellipodium; growth cone; midbody; neuromuscular junction; cleavage furrow; neuronal cell body; dendritic spine; myosin II filament; postsynaptic actin cytoskeleton; glutamatergic synapse"	"GO:0003774; GO:0005524; GO:0051015; GO:0016459; GO:0000281; GO:0001701; GO:0001764; GO:0001778; GO:0003279; GO:0006887; GO:0006930; GO:0007097; GO:0007155; GO:0007411; GO:0007512; GO:0008283; GO:0008360; GO:0021592; GO:0021670; GO:0021678; GO:0021680; GO:0030048; GO:0035904; GO:0050714; GO:0050885; GO:0051017; GO:0055003; GO:0055015; GO:0060041; GO:0060976; GO:0070650; GO:0098974; GO:1905274; GO:0000146; GO:0000287; GO:0005524; GO:0008307; GO:0032027; GO:0035613; GO:0042802; GO:0043531; GO:0045159; GO:0048027; GO:0051015; GO:0001725; GO:0005819; GO:0005829; GO:0005844; GO:0005859; GO:0005903; GO:0005938; GO:0009898; GO:0030027; GO:0030426; GO:0030496; GO:0031594; GO:0032154; GO:0043025; GO:0043197; GO:0097513; GO:0098871; GO:0098978"
"Pastreoides36844"	2.61595099844249e-09	3.76827636740535e-13	0.00271105291154895	0.000118788757985172	0.308447359361194	0.719296243605923	0.240532120930616	396	""	""
"Pastreoides34304"	3.05332056187283e-09	0.569602060374749	0.000291021132007941	9.29280861397337e-06	0.0539037496384452	0.963662376723605	0.516160003513814	625	"P:signal transduction; P:intracellular signal transduction; P:regulation of cellular process; protein binding; cytoplasm"	"GO:0007165; GO:0035556; GO:0050794; GO:0005515; GO:0005737"
"Pastreoides19793"	3.10000023923716e-09	0.192535736781755	0.867926454383439	0.803770501336387	0.905394823089107	0.995258570988594	0.603814741460209	1908	"P:regulation of gene expression; P:ribosome biogenesis; P:regulation of RNA metabolic process; binding; nucleolus"	"GO:0010468; GO:0042254; GO:0051252; GO:0005488; GO:0005730"
"Pastreoides15478"	3.1152166789002e-09	0.852665078129586	0.478243509697896	0.804709688902551	0.718741575239739	0.746941191799853	1	710	"P:in utero embryonic development; protein binding; nucleoplasm; cytosol"	"GO:0001701; GO:0005515; GO:0005654; GO:0005829"
"Pastreoides64544"	3.36003018601914e-09	0.767356576316377	0.676321687746534	0.151270642556316	0.805473945181881	0.856796149446187	0.0147099217702415	352	"P:transmembrane transport; P:oocyte dorsal/ventral axis specification; P:heparan sulfate proteoglycan biosynthetic process; P:3'-phosphoadenosine 5'-phosphosulfate transport; P:3'-phosphoadenosine 5'-phosphosulfate biosynthetic process; protein binding; 3'-phosphoadenosine 5'-phosphosulfate transmembrane transporter activity; integral component of Golgi membrane; integral component of endoplasmic reticulum membrane"	"GO:0055085; GO:0007310; GO:0015012; GO:0046963; GO:0050428; GO:0005515; GO:0046964; GO:0030173; GO:0030176"
"Pastreoides33482"	3.73556192153352e-09	0.271626320207417	0.896466577044649	0.598726904829862	0.994873332757403	0.766253862226346	0.676510194378435	1477	"metal ion binding; nucleus; P:negative regulation of transcription by RNA polymerase II; P:regulation of telomere maintenance; DNA-binding transcription repressor activity, RNA polymerase II-specific; protein binding; cytosol; nuclear speck"	"GO:0046872; GO:0005634; GO:0000122; GO:0032204; GO:0001227; GO:0005515; GO:0005829; GO:0016607"
"Pastreoides08072"	4.08634324006956e-09	0.935860857961892	0.961039523499041	0.934493839790162	0.735300442706853	1	0.884345571539001	830	"cellular anatomical entity"	"GO:0110165"
"Pastreoides06499"	4.2703615939778e-09	0.0409187662363236	0.0139031056430849	0.220297041559289	0.915874816842407	0.706891400572898	0.976393915097373	1113	"P:'de novo' IMP biosynthetic process; phosphoribosylformylglycinamidine synthase activity; P:GMP biosynthetic process; P:'de novo' IMP biosynthetic process; P:purine nucleobase biosynthetic process; P:'de novo' AMP biosynthetic process; P:anterior head development; P:'de novo' XMP biosynthetic process; phosphoribosylformylglycinamidine synthase activity; binding; cytosol"	"GO:0006189; GO:0004642; GO:0006177; GO:0006189; GO:0009113; GO:0044208; GO:0097065; GO:0097294; GO:0004642; GO:0005488; GO:0005829"
"Pastreoides31305"	4.330274967966e-09	0.00166912351000621	0.0104686998785627	0.0746417395633604	0.932053736093313	0.821017842437339	0.301863455946104	296	"P:methionine biosynthetic process; zinc ion binding; betaine-homocysteine S-methyltransferase activity; P:type B pancreatic cell development; P:protein methylation; P:amino-acid betaine metabolic process; P:digestive system development; P:L-methionine salvage; zinc ion binding; protein-containing complex binding; betaine-homocysteine S-methyltransferase activity; cytosol; protein-containing complex; extracellular exosome"	"GO:0009086; GO:0008270; GO:0047150; GO:0003323; GO:0006479; GO:0006577; GO:0055123; GO:0071267; GO:0008270; GO:0044877; GO:0047150; GO:0005829; GO:0032991; GO:0070062"
"Pastreoides18001"	4.33653346453018e-09	0.158500243724012	0.000721382845008495	0.994764286389023	0.847381515054965	0.706891400572898	0.84591372775945	174	""	""
"Pastreoides33872"	4.73973868915931e-09	7.55432714489995e-05	0.456778375861106	0.265263927647424	0.56597779815758	0.167264821883102	0.829249337788351	442	""	""
"Pastreoides11500"	4.9547836867138e-09	0.0149434840458326	0.0139031056430849	0.823710857241407	0.437891034947053	0.861693045798848	0.981269020092971	285	"triglyceride lipase activity; P:response to hormone; P:galactolipid catabolic process; phospholipase activity; triglyceride lipase activity; calcium ion binding; galactolipase activity; extracellular region"	"GO:0004806; GO:0009725; GO:0019376; GO:0004620; GO:0004806; GO:0005509; GO:0047714; GO:0005576"
